id,slug,shortname,name,city,region,country,coordinates,source,currentPrediction,contact,isGroundhog,type,active,successor,description
74,heavens-wildlife-harvey,Harvey,Heaven’s Wildlife Harvey,Oil Springs,Ontario,Canada,"42.7669782,-82.1832562",https://www.facebook.com/profile.php?id=100068618865920,https://www.theobserver.ca/news/local-news/earlier-spring-on-the-way-predicts-heavens-wildlife-harvey,,TRUE,Groundhog,TRUE,,"Heaven’s Wildlife Harvey is a somewhat rotund groundhog who is the official forecaster for the Heaven’s Wildlife Rescue Centre near Oil Springs, Ontario. Harvey succeeds Oil Springs Ollie, who began making predictions in 2014. “Harvey is doing great in his new role,” says Peggy Jenkins, founder of Heaven’s Wildlife Rescue. “Ollie taught him well.” However, Harvey can be a little more rambunctious: while Ollie was laid back and easy-going, Harvey is “kind of a little brat.”"
75,lady-edwina-of-essex,Lady Edwina,Lady Edwina of Essex,West Orange,New Jersey,USA,"40.7674513,-74.2839038",https://www.facebook.com/TurtleBackZoo/,https://www.facebook.com/TurtleBackZoo/posts/pfbid02M71Q9kH3vzzDtSB8HWzr4JtMAi7DDpEDaNBVDce6PfNYxZLTtzyrWuSxzaRTWLSul,,TRUE,Groundhog,TRUE,,"Lady Edwina of Essex is a gentlewoman groundhogess who makes an annual Groundhog Day forecast from the Turtle Back Zoo in New Jersey. Lady Edwina is a relatively junior prognosticator but she continues a proud prognosticating dynasty — taking over from Essex Ed, who retired from forecasting in 2021. Lady Edwina consults “models and maps”, not just shadows, to make 2 yearly predictions: one for the upcoming weather, and another for the results of the Super Bowl."
76,okanagan-okie,Okie,Okanagan Okie,Vernon,British Columbia,Canada,"50.2400127,-119.2915259",https://www.facebook.com/AllanBrooksNatureCentre/,https://www.facebook.com/AllanBrooksNatureCentre/videos/968213791362812/,info@abnc.ca,FALSE,Person in yellow-bellied marmot suit,TRUE,,"Meet Okanagan Okie, the newest addition to the Allan Brooks Nature Centre family! Okie is a charming Yellow-Bellied Marmot hailing from Vernon, BC, and proud cousin to the marmots that call the Centre home. Known for his flair for theatre and larger-than-life personality, Okie was unanimously elected to take on the prestigious role of spokes-marmot for ABNC. Okie has trained diligently in the ancient art of weather prognostication for the Centre’s Groundhog Day celebrations. However, Okie still has one challenge—he’s not exactly a morning marmot! He needs a little encouragement from the community to rise and shine on time for his special day."
77,pisgah-penny,Penny,Pisgah Penny,Brevard,North Carolina,USA,"35.243478,-82.7769959",https://www.facebook.com/whitesquirrelinstitute,https://www.facebook.com/whitesquirrelinstitute/posts/pfbid02hPREHeeEVQ3oqguYA5NnFU77FynXyJy4b26K8e66c8uZttQJTegzgn9UwVZ8uRBnl,,FALSE,Tree squirrel,TRUE,,"Pisgah Penny is a white Tree Squirrel who makes an annual prediction for “White Squirrel Day” in Brevard, North Carolina. White Squirrel Day is similar in many respects to Groundhog Day, the primary difference being the substitution of a groudhog for a squirrel. Penny’s predictions are based on what side of her display cage she moves to, one side signifying early spring and the other six more weeks winter. Brevard Mayor Maureen Copelof says “Pisgah Penny has established herself as a beloved and valued member of this community who openly asserts her love for Brevard,” while “Punxsutawney Phil has established himself as, let’s be honest, an ill tempered, unreliable predictor.”"
78,queen-city-charlie,Charlie,Queen City Charlie,Cumberland,Maryland,USA,"39.6528658,-78.7646866",https://www.facebook.com/cityofcumberlandmd,https://www.facebook.com/historicdowntowncumberland/videos/1332591510764739/,melinda.kelleher@cumberlandmd.gov,FALSE,Person in a groundhog suit,TRUE,,"Queen City Charlie is a prognosticating person in a groundhog suit who makes an annual prediction for the city of Cumberland, Maryland. Charlie (pictured, right) is a political animal whose predictive press releases are made at City Hall Plaza by the mayor, who Charlie is frequently pictured next to. Charlie is a person-sized replacement for Mountain Maryland Murray, the city’s former furry prognosticator who retired in 2021."
79,unadilla-billie,Billie,Unadilla Billie,Unadilla,Nebraska,USA,"40.6834005,-96.2751068",https://www.facebook.com/profile.php?id=100064741024244,https://www.facebook.com/permalink.php?story_fbid=pfbid0BMQge7mKVxoYC4aQuNVg7hdKA6nNLC9gqrLCwfWGFnWzzwcwc9veAYs1E5SK76jPl&id=100064741024244,,FALSE,Taxidermied groundhog,TRUE,,"Unadilla Billie is a taxidermied lady groundhog who makes an annual Groundhog Day prediction for the town of Unadilla, Nebraska. Billie is a novice groundhog, the successor to longtime prognosticator Unadilla Bill, who predicted the arrival of spring  from 1988 to the pandemic year of 2021. Billie is relishing her new role, writing poetic predictions and taking selfies with fans. Billie is a master of camouflage, able to blend in with her surroundings and remain perfectly still in just about any urban setting."
80,cedar-the-groundhog,Cedar,Cedar the Groundhog,West Dundee,Illinois,USA,"42.1157016,-88.3362437",https://www.facebook.com/RandallOaksZoo,https://www.facebook.com/RandallOaksZoo/posts/pfbid0rYd4wUFPb1HmcZ4qoni37rzRtLYHjqtEbLhgdjToLHwf33vg5dwBCGTJasyKsPhRl,,TRUE,Groundhog,TRUE,,"Cedar the Groundhog (aka, Squish) is a young whistlepig who gives official prognostications for the Randall Oaks Zoo in West Dundee, Illinois. Cedar was orphaned at a very young age and entered the care of the zoo. Typically Gen-Z, Cedar is very friendly and loves getting attention (his predictions are streamed on Facebook), which is why he invites lots of people to his parties. For any partygoers unsure how to shop for a groundhog, Cedar unsubtly posted on Facebook that he loves banana chips.  "
81,elliott-the-groundhog,Elliott,Elliott the Groundhog,Millersville,Pennsylvania,USA,"40.1213254,-76.6644525",https://www.facebook.com/AcornAcresWR,https://lancasteronline.com/elliott-makes-his-first-official-groundhog-day-prediction-photos/collection_35bd0144-c116-11ee-996c-2b15bc4826f4.html,info@acornacreswr.com,TRUE,Groundhog,TRUE,,"Elliott the Groundhog is an educational ambassador with Acorn Acres Wildlife Rehabilitation in Millersville, Pennsylvania. After shadowing his big sister Poppy, Elliott took over her prognosticating duties for the first time in 2024. Departing from the more traditional ‘shadow’ technique, Elliot uses the “treat method” to make his prediction. He gets two identical treat dishes: one says “spring” and the other “winter.” Whichever bowl Elliot eats from is his prediction. Elliott is a bit of a sartorialist and has been known to wear a miniature tuxedo for special occasions."